{
  "$schema": "https://tensegrity-audio.github.io/project_ops/schemas/v0.2.0/project_config.schema.json",
  "project": {
    "id": "minimal-project",
    "name": "Minimal Project",
    "role": "example-adopter"
  },
  "paths": {
    "roadmap": "docs/roadmap/roadmap.md",
    "inProgress": "docs/roadmap/in_progress",
    "completed": "docs/roadmap/completed",
    "reports": "docs/reports",
    "changelog": "docs/reports/changelog.md",
    "governance": "docs/governance",
    "requestTemplate": "docs/roadmap/in_progress/_REQUEST_TEMPLATE.md",
    "projectOpsContract": "docs/project_ops.md",
    "templateRoot": "docs/templates",
    "projectAdminBaselineTemplate": "docs/templates/project_admin_baseline.md",
    "prioritizationPolicy": "docs/governance/prioritization_policy.md",
    "designAlignmentLog": "docs/architecture/design_alignment_log.md"
  },
  "scopeLabels": [
    "governance",
    "docs"
  ],
  "requiredDocs": [
    "README.md",
    "CONTRIBUTING.md",
    "CHANGELOG.md",
    ".gitignore",
    ".project_ops/config.json",
    "docs/project_ops.md",
    "docs/roadmap/roadmap.md",
    "docs/roadmap/in_progress/_REQUEST_TEMPLATE.md",
    "docs/architecture/README.md",
    "docs/architecture/design_alignment_log.md",
    "docs/governance/README.md",
    "docs/reports/changelog.md"
  ],
  "privacy": {
    "defaultVisibility": "public",
    "publicExamplesRequireSanitization": true,
    "privateHistoryPaths": [
      "docs/private/**",
      ".local/**"
    ]
  },
  "validation": {
    "requireChangelog": true,
    "requireRoadmapParity": true,
    "allowEmptyRoadmap": true,
    "dryRunByDefault": true,
    "commands": [
      {
        "name": "project-ops-audit",
        "command": "python <path-to-project_ops>/tools/project_ops_audit.py --repo .",
        "required": true,
        "description": "Audit local Project Ops structure without rewriting files."
      },
      {
        "name": "request-audit",
        "command": "python <path-to-project_ops>/tools/project_ops_request_audit.py --repo . --request-id <request_id>",
        "required": true,
        "description": "Audit one request artifact against local roadmap and changelog state."
      },
      {
        "name": "roadmap-check",
        "command": "python <path-to-project_ops>/tools/project_ops_roadmap.py --repo .",
        "required": true,
        "description": "Check roadmap entries against local request artifacts without rewriting files."
      }
    ]
  },
  "bootstrap": {
    "requiredFiles": [
      "README.md",
      "CONTRIBUTING.md",
      "CHANGELOG.md",
      ".gitignore",
      ".project_ops/config.json",
      "docs/project_ops.md",
      "docs/roadmap/roadmap.md",
      "docs/roadmap/in_progress/_REQUEST_TEMPLATE.md",
      "docs/reports/changelog.md",
      "docs/architecture/design_alignment_log.md"
    ],
    "recommendedFiles": [
      ".editorconfig",
      "LICENSE",
      "SECURITY.md",
      "docs/governance/prioritization_policy.md"
    ],
    "initialDirectories": [
      "docs/architecture",
      "docs/governance",
      "docs/roadmap/in_progress",
      "docs/roadmap/completed",
      "docs/reports",
      "docs/templates"
    ]
  }
}
